words,definitions,proficiency,index
grave,serious requiring consideration         ,None,483
graze,touch or scrape lightly in passing    ,None,484
gregarious,living in societies liking the company      ,None,485
grievous,causing grief or pain serious dire grave     ,None,486
grovel,crawl humble oneself         ,None,487
guile,deceit cunning          ,None,488
gullible,easily gulled          ,None,489
gush,burst out suddenly/talk ardently      ,None,490
gust,outburst of feeling sudden rain wind fire etc.    ,None,491
hack,cut roughly hired horse        ,None,492
halcyon,calm and peaceful       ,None,493
hallow,to make holy consecrate        ,None,494
harangue,a long passionate speech        ,None,495
harbinger,smth or smb that foretells the coming of    ,None,496
harrow,to distress create stress or torment      ,None,497
haughty,arrogant conceited          ,None,498
heed,attention/give notice to       ,None,499
heinous,odious (of crime)         ,None,500
heresy,belief contrary to what is generally accepted     ,None,501
hermetic,sealed by fusion         ,None,502
heterogeneous,made up of different kinds       ,None,503
hew,make by hard work cut (by striking)     ,None,504
highbrow,(person) with superior tastes      ,None,505
hirsute,hairy shaggy          ,None,506
hoax,mischievous trick played on smb for a joke    ,None,507
hoi,polloi the masses the rabble       ,None,508
hollow,not soled with hole        ,None,509
holster,leather case for a pistol       ,None,510
homiletics,act of preaching       ,None,511
hone,stone used for sharpening tools       ,None,512
hoodwink,trick mislead          ,None,513
hospitable,liking to give hospitality        ,None,514
hubris,arrogant pride          ,None,515
hush,make or become silent      ,None,516
husk,worthless outside part of anything       ,None,517
hypocrisy,falsely making oneself appear to be good     ,None,518
iconoclast,person who attacks popular beliefs       ,None,519
idiosyncrasy,personal mannerism          ,None,520
idolatry,excessive admiration of         ,None,521
idyll,a carefree episode or experience       ,None,522
ignoble,dishonorable common undignified         ,None,523
ignominious,shameful dishonorable undignified disgraceful        ,None,524
illicit,unlawful forbidden          ,None,525
imbroglio,complicated and embarrassing situation        ,None,526
immaculate,pure faultless          ,None,527
imminent,likely to come or happen soon      ,None,528
immutable,that cannot be changed        ,None,529
impair,worsen diminish in value        ,None,530
impassive,unmoved feeling no sign of passion      ,None,531
impecunious,having little or no money       ,None,532
impede,hinder get in the way of      ,None,533
impediment,smth that hinders (e.g. stammer)       ,None,534
impending,imminent being about to happen expected      ,None,535
imperative,urgent essential          ,None,536
imperious,commanding haughty arrogant         ,None,537
impermeable,that cannot be permeated        ,None,538
imperturbable,calm not capable of being excited      ,None,539
impervious,not allowing to pass through (of materials)     ,None,540
imperviousness,haughty arrogant commanding         ,None,541
impetuous,having sudden energy impulsive thrusting ahead forceful     ,None,542
impiety,lack of reverence or dutifulness       ,None,543
implacable,incapable of being placated unpleasable       ,None,544
implicate,show that smb has a share      ,None,545
implicit,implied though not plainly expressed       ,None,546
implosion,collapse bursting inward         ,None,547
importune,beg urgently solicit (of a prostitute)      ,None,548
imprecation,an invocation of evil a curse      ,None,549
impromptu,without preparation          ,None,550
impudent,rash indiscreet          ,None,551
impugned,challenged to be doubted        ,None,552
impute,to attribute to a cause or source ascribe    ,None,553
inadvertent,not paying proper attention        ,None,554
inane,silly senseless          ,None,555
inasmuch,since because          ,None,556
incense,make angry          ,None,557
incessant,often repeated continual         ,None,558
inchoate,not yet fully formed rudimentary elementary      ,None,559
incipient,beginning         ,None,560
incise,engrave make a cut in       ,None,561
incite,stir up rouse         ,None,562
inclined,directing the mind in a certain direction     ,None,563
incongruous,out of place not in harmony or agreement    ,None,564
incorrigibility,cannot be cured or corrected       ,None,565
incredulous,skeptical unwilling to believe        ,None,566
inculcate,fix firmly by repetition        ,None,567
incumbents,official duties          ,None,568
incursion,a raid a sudden attack       ,None,569
indefatigability,not easily exhaustible tirelessness        ,None,570
indelible,that cannot be rubbed out       ,None,571
indigence,poverty           ,None,572
indigenous,native           ,None,573
indistinct,not easily heard seen clearly marked      ,None,574
indolence,laziness           ,None,575
indomitable,not easily discouraged or subdued       ,None,576
indulge,gratify give way to satisfy allow oneself     ,None,577
indulgent,inclined to indulge         ,None,578
ineffable,to great to be described in words     ,None,579
ineluctable,certain inevitable          ,None,580
inept,unskillful said or done at the wrong time    ,None,581
ineptitude,quality of being unskillful      ,None,582
inferno,hell         ,None,583
infuriate,fill with fury or rage       ,None,584
infuse,put pour fill         ,None,585
ingenuous,naive young artless frank honest sincere      ,None,586
ingest,take in by swallowing        ,None,587
inimical,harmful or friendly         ,None,588
inimitable,defying imitation unmatchable         ,None,589
innocuous,causing no harm         ,None,590
inscrutable,incapable of being discovered or understood      ,None,591
insensible,unconscious unresponsive unaffected         ,None,592
insinuate,suggest unpleasantly make a way for smth gently    ,None,593
insipid,without taste or flavor        ,None,594
insouciant,unconcerned carefree          ,None,595
insularity,narrow-mindedness isolated          ,None,596
insurrection,rising of people to open resistance to     ,None,597
interdict,prohibit forbid          ,None,598
interim,as an installment         ,None,599
intersperse,place here and there        ,None,600
intransigence,unwillingness to compromise stubbornness intractability       ,None,601
intransigent,uncompromising           ,None,602
intrepid,fearless brave undaunted         ,None,603
introspection,examining one's own thoughts and feelings      ,None,604
inundate,flood cover by overflowing        ,None,605
inured,accustomed to adapted         ,None,606
invective,abusive language curses         ,None,607
inveigh,to attack verbally denounce deprecate       ,None,608
inveterate,deep-rooted. long-established          ,None,609
invincible,too strong to be defeated     ,None,610
involute,complex           ,None,611
irascible,irritable easily angered         ,None,612
irate,angry           ,None,613
ire,anger           ,None,614
irksome,tiresome           ,None,615
irresolute,hesitating undecided          ,None,616
irrevocable,final and unalterable         ,None,617
itinerate,to travel from place to place to peregrinate    ,None,618
jabber,talk excitedly utter rapidly        ,None,619
jibe,gibe make fun of        ,None,620
jocular,meant as a joke        ,None,621
judicious,sound in judgment wise        ,None,622
knit,draw together unite firmly        ,None,623
labyrinthine,to entangle the state of affairs      ,None,624
lachrymose,causing tears tearful         ,None,625
lackluster,(of eyes) dull         ,None,626
lament,show feel great sorrow        ,None,627
lassitude,weariness tiredness          ,None,628
latent,present but not yet active developed or visible    ,None,629
laudatory,expressing or giving praise        ,None,630
lavish,giving or producing freely liberally or generously     ,None,631
legacy,smth handed down from ancestors       ,None,632
levee,formal reception/embankment        ,None,633
levity,lack of seriousness       ,None,634
libel,statement that damages reputation        ,None,635
liberality,free giving generosity         ,None,636
libertine,immoral person          ,None,637
lien,legal claim until a debt on it is repaid   ,None,638
limn,paint portray          ,None,639
limp,lacking strength walking unevenly        ,None,640
lionize,treat as a famous person     ,None,641
lithe,bending twisting          ,None,642
loll,rest to sit or stand in a lazy way hang (dog's tongue),None,643
lope,move along with long strides     ,None,644
loquacious,talkative garrulous          ,None,645
lucubrate,write in scholarly fashion        ,None,646
luculent,easily understood lucid clear        ,None,647
lugubrious,mournful excessively sad         ,None,648
lull,become quiet or less active       ,None,649
lumber,move in a clumsy/noisy way     ,None,650
luminary,star light-giving body         ,None,651
lurk,be out of view ready to attack   ,None,652
lustrous,being bright polished         ,None,653
macabre,gruesome suggesting death         ,None,654
macerate,make or become soft by soaking in water  ,None,655
machination,plot scheme (esp. evil)        ,None,656
maladroit,tactless clumsy          ,None,657
malapropism,misuse of a word (for one that resembles it)   ,None,658
malevolence,wishing to do evil        ,None,659
malign,injurious speak ill of smb tell lie     ,None,660
malinger,to fake illness or injury in order to shirk a duty ,None,661
malleable,yielding easily shaped moldable adapting       ,None,662
manacle,chains for the hands or feet      ,None,663
massacre,cruel killing of a large number of people    ,None,664
matriculation,be admitted enter a university as a student    ,None,665
maudlin,sentimental in a silly or tearful way     ,None,666
maul,hurt by rough handling      ,None,667
maverick,rebel nonconformist          ,None,668
mellifluous,sweetly flowing          ,None,669
mendacity,dishonesty           ,None,670
mendicant,a beggar          ,None,671
mercurial,quick changeable in character fleeting       ,None,672
meretricious,attractive on the surface but of little value    ,None,673
mesmerize,hypnotize           ,None,674
meticulous,giving great attention to details       ,None,675
mettle,quality of endurance or courage       ,None,676
mettlesome,courageous high-spirited          ,None,677
middling,fairly good but not very good      ,None,678
minatory,menacing threatening          ,None,679
mince,pronounce or speak affectedly euphemize       ,None,680
misanthrope,person who hates mankind        ,None,681
mischievous,harmful causing mischief         ,None,682
miser,person who loves wealth and spends little     ,None,683
misogynist,one who hates women/females        ,None,684
moderation,quality of being limited not extreme      ,None,685
mollify,make calmer or quieter        ,None,686
molt,moult lose hair feathers before new growing     ,None,687
morbid,diseased unhealthy (e.g.. about ideas)       ,None,688
morose,ill-tempered unsocial          ,None,689
muffler,cloth worn round the neck/silencer     ,None,690
multifarious,varied motley greatly diversified        ,None,691
mundane,worldly as opposed to spiritual commonplace everyday     ,None,692
myriad,very great number         ,None,693
nadir,lowest weakest point         ,None,694
nascent,coming into existence emerging        ,None,695
nebulous,cloud-like hazy vague indistinct        ,None,696
negligent,taking too little care        ,None,697
neophyte,person who has been converted to a belief    ,None,698
nexus,a connection tie or link       ,None,699
nibble,show some inclination to accept (an offer)     ,None,700
noisome,offensive disgusting (smell)         ,None,701
nonchalant,not having interest         ,None,702
nonplused,greatly surprised          ,None,703
nostrum,a quack remedy an untested cure      ,None,704
noxious,harmful           ,None,705
nugatory,trifling/worthless         ,None,706
obdurate,hardened and unrepenting stubborn inflexible       ,None,707
obfuscate,to darken make obscure muddle       ,None,708
oblivious,unaware having no memory        ,None,709
obloquy,abusively detractive language sharp criticism vituperation      ,None,710
obsequious,too eager to obey or serve      ,None,711
obstreperous,noisy loud          ,None,712
obtain,to be established accepted or customary      ,None,713
obtrusive,projecting prominent undesirably noticeable        ,None,714
obtuse,blunt/stupid         ,None,715
obviate,to make unnecessary get rid of      ,None,716
occluded,blocked up          ,None,717
odious,repulsive hateful          ,None,718
odium,contempt dislike aversion         ,None,719
odor,smell favor reputation         ,None,720
officious,too eager or ready to help offer advice    ,None,721
ominous,threatening         ,None,722
onerous,needing effort burdensome         ,None,723
opaqueness,dullness/not allowing light to pass through    ,None,724
opprobrious,showing scorn or reproach        ,None,725
ossify,to turn to bone to settle rigidly into an idea  ,None,726
ostensible,seeming appearing as such professed       ,None,727
ostentation,display to obtain admiration or envy      ,None,728
ostracism,shut out from society refuse to meet talk    ,None,729
overhaul,examine thoroughly to learn about the condition     ,None,730
overweening,presumptuously arrogant overbearing immoderate being a jerk     ,None,731
paean,song of praise or triumph       ,None,732
palate,roof of the mouth sense of taste     ,None,733
palatial,magnificent           ,None,734
palliate,lessen the severity of        ,None,735
palpability,can be felt touched understood       ,None,736
palpitate,tremble beat rapidly and irregularly       ,None,737
panegyric,formal praise eulogy         ,None,738
paradigm,a model example or pattern       ,None,739
parenthesis,sentence within another one smth separated      ,None,740
pariah,an outcast a rejected and despised person     ,None,741
parsimonious,too economical miserly         ,None,742
partisan,one-sided committed to a party biased or prejudiced    ,None,743
patron,regular customer person who gives support      ,None,744
paucity,scarcity a lacking of        ,None,745
peccadillo,small sin small weakness in one's character     ,None,746
pedantic,bookish showing off learning        ,None,747
pedestrian,commonplace trite unremarkable         ,None,748
pellucid,transparent easy to understand        ,None,749
penchant,strong inclination a liking        ,None,750
penitent,feeling or showing regret        ,None,751
penurious,poor/stingy         ,None,752
penury,extreme poverty          ,None,753
peregrination,traveling about wandering         ,None,754
peremptory,urgent imperative unchallengeable ending debate       ,None,755
perfidious,treacherous faithless          ,None,756
perfidy,treachery breaking of faith        ,None,757
perfunctory,done as a duty without care      ,None,758
perilous,dangerous           ,None,759
peripatetic,wandering           ,None,760
perish,be destroyed decay         ,None,761
perjury,willful FALSE statement unlawful act       ,None,762
permeate,spread into every part of       ,None,763
pernicious,harmful injurious          ,None,764
perpetrate,be guilty commit (a crime)       ,None,765
personable,pleasing in appearance attractive        ,None,766
perspicacity,quick judging and understanding        ,None,767
pertain,belong as a part have reference      ,None,768
pest,destructive thing or a person who is nuisance    ,None,769
petrified,taken away power (to think feel act)     ,None,770
petrify,to make hard rocklike        ,None,771
petrous,like a rock hard stony       ,None,772
petulant,unreasonably impatient          ,None,773
philistine,a smug ignorant person one who lacks knowledge    ,None,774
phlegmatic,calm sluggish temperament unemotional        ,None,775
picaresque,involving clever rogues or adventurers       ,None,776
pied,of mixed colors         ,None,777
pinch,be too tight take between the thumb and finger   ,None,778
pine,waste away through sorrow or illness    ,None,779
pious,dutiful to parents devoted to religion      ,None,780
piquant,agreeably pungent stimulating         ,None,781
pique,hurt the pride or self-respect stir (curiosity)     ,None,782
pitfall,covered hole as a trap unsuspected danger     ,None,783
pith,essential part force soft liquid substance      ,None,784
pivotal,of great importance (others depend on it)     ,None,785
placate,soothe pacify calm         ,None,786
plaintive,mournful melancholy sorrowful         ,None,787
plaque,flat metal on a wall as a memorial    ,None,788
platitude,a trite or banal statement unoriginality      ,None,789
plea,request           ,None,790
plead,address a court of law as an advocate    ,None,791
plethora,glut           ,None,792
pliant,pliable easily bent shaped or twisted      ,None,793
plod,continue doing smth without resting       ,None,794
pluck,pull the feathers off pick (e.g.. flowers)     ,None,795
plumb,get to the root of       ,None,796
plummet,fall plunge steeply         ,None,797
plunge,move quickly suddenly and with force      ,None,798
poignant,deeply moving keen         ,None,799
poncho,large piece of cloth      ,None,800
ponderous,heavy bulky dull         ,None,801
portent,omen marvelous threatening         ,None,802
precarious,uncertain risky dangerous         ,None,803
precepts,rules establishing standards of conduct       ,None,804
preclude,prevent make impossible         ,None,805
precursory,preliminary anticipating          ,None,806
predilection,special liking mental preference        ,None,807
predominate,have more power than others       ,None,808
preen,tidy/show self-satisfaction        ,None,809
premature,doing or happening smth before the right time    ,None,810
preponderance,greatness in number strength weight       ,None,811
presage,warning sign          ,None,812
presumption,arrogance         ,None,813
preternatural,not normal or usual        ,None,814
prevalent,common           ,None,815
prevaricate,to equivocate to stray from the truth     ,None,816
prim,neat formal          ,None,817
pristine,primitive unspoiled pure as in earlier times unadulterated    ,None,818
probity,uprightness incorruptibility principle         ,None,819
proclivity,inclination           ,None,820
procrastination,keeping on putting off        ,None,821
prodigal,wasteful reckless with money        ,None,822
prodigious,enormous wonderful          ,None,823
profane,worldly having contempt for God       ,None,824
profligacy,shameless immorality        ,None,825
profligate,wasteful prodigal licentious extravagant        ,None,826
profundity,depth           ,None,827
profuse,abundant/lavish         ,None,828
proliferate,grow reproduce by rapid multification       ,None,829
prolix,tiring because too long        ,None,830
prone,prostrate inclined to (undesirable things)       ,None,831
propagation,increasing the number spreading extending       ,None,832
propinquity,nearness in time or place affinity of nature    ,None,833
propitiatory,conciliatory appeasing mitigating         ,None,834
propitious,auspicious presenting favorable circumstances        ,None,835
prosaic,everyday mundane commonplace trite pedestrian       ,None,836
proscribe,denounce as dangerous         ,None,837
protracted,prolonged           ,None,838
provident,frugal looking to the future       ,None,839
provisional,of the present time only       ,None,840
provoke,make angry vax         ,None,841
prudence,careful forethought          ,None,842
prudish,easily shocked excessively modest        ,None,843
prune,dried plum silly person        ,None,844
pry,get smth inquire too curiously       ,None,845
pucker,wrinkle         ,None,846
pugnacious,fond of in the habit of fighting     ,None,847
puissance,strength         ,None,848
punctilious,precise paying attention to trivialities       ,None,849
pundit,pedant authority on a subject       ,None,850
pungency,sharpness stinging quality         ,None,851
purvey,provide supply          ,None,852
pusillanimous,cowardly craven          ,None,853
putrefaction,becoming rotten        ,None,854
pyre,large pile of wood for burning      ,None,855
quack,person dishonestly claiming to smth       ,None,856
quaff,drink deeply          ,None,857
quail,lose courage turn frightened        ,None,858
qualm,feeling of doubt temporary feeling of sickness     ,None,859
quandary,state of doubt or perplexity     ,None,860
quell,suppress subdue          ,None,861
quibble,try to avoid by sophistication       ,None,862
quiescence,state of being passive/motionless      ,None,863
quiescent,at rest dormant torpid        ,None,864
quirk,habit or action peculiar to smb or smth    ,None,865
quixotic,generous unselfish          ,None,866
quotidian,banal everyday          ,None,867
rabble,mob crowd the lower classes of populace     ,None,868
raconteur,person who tells anecdotes        ,None,869
raffish,low vulgar base tawdry        ,None,870
ramify,to be divided or subdivided to branch out    ,None,871
rancorous,feeling bitterness spitefulness         ,None,872
rant,use extravagant language         ,None,873
rapacious,greedy (esp for money)        ,None,874
rarefy,to make thin to make less dense to purify or refine ,None,875
rave,act with excessive enthusiasm      ,None,876
reactionary,opposing progress          ,None,877
rebuff,snub           ,None,878
recalcitrant,disobedient           ,None,879
recant,take back as being FALSE give up     ,None,880
recast,cast or fashion anew        ,None,881
recidivism,relapse into antisocial or criminal behavior      ,None,882
reciprocity,granting of privileges in return for similar     ,None,883
recitals,a number of performance of music      ,None,884
recluse,person who lives alone and avoids people     ,None,885
recompense,make payment to reward punish       ,None,886
reconcile,settle a quarrel restore peace       ,None,887
recondite,little known abstruse         ,None,888
recreancy,cowardice a cowardly giving up       ,None,889
recuperate,become strong after illness loss exhaustion      ,None,890
redeem,get back by payment compensate       ,None,891
redoubtable,formidable causing fear         ,None,892
refine,make or become pure cultural       ,None,893
refractory,stubborn unmanageable untractable         ,None,894
refulgent,shining brilliant          ,None,895
regale,to delight or entertain to feast      ,None,896
regicide,crime of killing a king       ,None,897
reiterate,say or do again several times      ,None,898
rejuvenation,becoming young in nature or appearance      ,None,899
relapse,fall back again         ,None,900
remonstrate,to protest object         ,None,901
render,deliver provide represent         ,None,902
renovate,restore smth to better condition       ,None,903
renowned,celebrated famous          ,None,904
repast,meal           ,None,905
repel,refuse to accept/cause dislike      ,None,906
repine,at be discontented with        ,None,907
reproach,scold upbraid          ,None,908
reprobate,person hardened in sin one devoid of decency    ,None,909
repudiate,disown refuse to accept or pay      ,None,910
repulsive,causing a feeling of disgust       ,None,911
requite,repay give in return        ,None,912
rescind,repeal/annul/cancel         ,None,913
resigned,unresisting submissive          ,None,914
resilience,quality of quickly recovering the original shape     ,None,915
resort,to frequently visit         ,None,916
restive,refusing to move reluctant to be controlled     ,None,917
resuscitation,coming back to consciousness        ,None,918
retard,check hinder          ,None,919
reticent,reserved untalkative silent taciturn        ,None,920
revere,have deep respect for        ,None,921
reverent,feeling or showing deep respect     ,None,922
riddle,puzzling person or thing      ,None,923
rift,split crack dissension         ,None,924
rivet,fix take up secure metal pin      ,None,925
roll,call calling of names        ,None,926
rotund,rich and deep plump and round      ,None,927
ruffian,violent cruel man         ,None,928
rumple,make rough        ,None,929
sagacious,having sound judgment perceptive wise like a sage    ,None,930
salacious,obscene           ,None,931
salubrious,healthful           ,None,932
salutary,remedial wholesome causing improvement        ,None,933
sanctimony,self-righteousness hypocritical with FALSE piety       ,None,934
sanction,approval (by authority) penalty        ,None,935
sanguine,cheerful confident optimistic         ,None,936
sanity,health of mind soundness of judgement      ,None,937
sash,long strip worn round the waist    ,None,938
satiate,satisfy fully          ,None,939
saturnine,gloomy dark sullen morose        ,None,940
savant,person of great learning        ,None,941
savor,taste flavor smth         ,None,942
sawdust,tiny bits of wood        ,None,943
scabbard,sheath for the blade        ,None,944
scent,smell (esp pleasant)         ,None,945
scorch,become discolored/dry up/go at high speed    ,None,946
scribble,write hastily          ,None,947
scurvy,mean contemptible          ,None,948
secular,material (not spiritual) living outside monasteries      ,None,949
sedulous,persevering           ,None,950
seminal,like a seed constituting a source originative     ,None,951
sententious,short and pithy full of maxims/proverbs      ,None,952
sequence,succession connected line of        ,None,953
sere,make hard and without feeling     ,None,954
sermon,reproving a person for his faults    ,None,955
